,mention,anchor_type,mention_token_id,mention_character_id,eventclass,Patient_offsets,Agent_offsets,Location_offsets,Time_offsets,AgentPatient_offsets,Benefactive_offsets,Cargo_offsets,Source_offsets,Target_offsets,Path_offsets,Instrument_offsets,mention_span,mention_span_ids,mention_in_context,eventclass_no_number,last_token_id
0,gescheijden,isOfType,12-35,410-421,Leaving,None,None,['12-34'],['12-28[79]'],None,None,None,None,None,None,"['12-13[70]', '12-18[74]', '12-22[76]', '12-16[72]', '12-26[78]']",gescheijden,['12-35'],", Twdapen van Eelff , s'landts hollandia ende de Galias den 12en November past in Compe van Battania- Battania [ gescheijden ] , ende den 15en . do door de strate Sunda geraeckt sijn hier Godt loff den 17en . ende 21e",Leaving,12-35
1,geraeckt,isOfType,12-46,464-472,TransLocation[234],None,None,['12-42[81]'],['12-39[80]'],None,None,None,None,None,None,"['12-22[75]', '12-18[73]', '12-26[77]', '12-13[69]', '12-16[71]']",geraeckt sijn,"['12-46', '12-47']","12en November past in Compe van Battania- Battania gescheijden , ende den 15en . do door de strate Sunda [ geraeckt sijn ] hier Godt loff den 17en . ende 21e . l. van Teijouhan ende Jappan successiue- wel aengecomen t'Jacht Erabinus",TransLocation,12-47
2,sijn,isOfType,12-47,473-477,TransLocation[234],None,None,['12-42[81]'],['12-39[80]'],None,None,None,None,None,None,"['12-22[75]', '12-18[73]', '12-26[77]', '12-13[69]', '12-16[71]']",geraeckt sijn,"['12-46', '12-47']","12en November past in Compe van Battania- Battania gescheijden , ende den 15en . do door de strate Sunda [ geraeckt sijn ] hier Godt loff den 17en . ende 21e . l. van Teijouhan ende Jappan successiue- wel aengecomen t'Jacht Erabinus",TransLocation,12-47
3,aengecomen,isOfType,12-64,560-570,Arriving,None,None,None,['12-52[83]'],None,None,"['12-74[87]', '12-82[88]']","['12-59', '12-61']",None,None,"['12-68[86]', '12-65[85]']",aengecomen,['12-64'],"Sunda geraeckt sijn hier Godt loff den 17en . ende 21e . l. van Teijouhan ende Jappan successiue- wel [ aengecomen ] t'Jacht Erabinus ende t'Schip de Vreede t'samen geladen met 840 . pica rouwe Chineesche sijde , ende 332 xxi0 .",Arriving,12-64
4,aencompete,evokes,12-91.1,704-714,Arriving,None,None,None,None,None,None,None,None,None,None,None,aencompete,['12-91.1'],"geladen met 840 . pica rouwe Chineesche sijde , ende 332 xxi0 . copter . e. e e Op [ aencompete ] aencompete gemelter Schepen hebben , dadelijck met den Raedt ouerleijdt , off niet oorbaer ende raedtsaem soude wesen , noch",Arriving,12-91.1
5,nae,isOfType,12-135,963-966,Transportation[235],['12-114[91]'],None,None,None,None,None,['12-118[93]'],None,None,None,['12-111[89]'],nae te seijnden,"['12-135', '12-136', '12-137']",", beneffens de becomene aduijsen van Teijouhan , ende — Japan , opt ' spoedichste de bouen gemelte Vloote [ nae te seijnden ] , om deselue noch t'sij dan aende Cabo ofte St. Sdelena te mogen beloopen . & Waerop aen",Transportation,12-137
6,te,isOfType,12-136,967-969,Transportation[235],['12-114[91]'],None,None,None,None,None,['12-118[93]'],None,None,None,['12-111[89]'],nae te seijnden,"['12-135', '12-136', '12-137']",", beneffens de becomene aduijsen van Teijouhan , ende — Japan , opt ' spoedichste de bouen gemelte Vloote [ nae te seijnden ] , om deselue noch t'sij dan aende Cabo ofte St. Sdelena te mogen beloopen . & Waerop aen",Transportation,12-137
7,seijnden,isOfType,12-137,970-978,Transportation[235],['12-114[91]'],None,None,None,None,None,['12-118[93]'],None,None,None,['12-111[89]'],nae te seijnden,"['12-135', '12-136', '12-137']",", beneffens de becomene aduijsen van Teijouhan , ende — Japan , opt ' spoedichste de bouen gemelte Vloote [ nae te seijnden ] , om deselue noch t'sij dan aende Cabo ofte St. Sdelena te mogen beloopen . & Waerop aen",Transportation,12-137
8,beloopen,isOfType,12-151,1044-1052,TransLocation,None,None,None,None,None,None,None,None,None,None,None,beloopen,['12-151'],"bouen gemelte Vloote nae te seijnden , om deselue noch t'sij dan aende Cabo ofte St. Sdelena te mogen [ beloopen ] . & Waerop aen d‛een sijde Ingesien sijnde , hoe voor t'verloop vanden gelimiteerden tijdt op d'affvaerdinge der Retour Schepen",TransLocation,12-151
9,Voijagie,evokes,12-198,1326-1334,Voyage,None,None,None,None,None,None,None,None,None,None,None,Voijagie,['12-198'],V Ed : aduisen met Bollandia Jongst van daer becomen niet wel doenlijck soude sijn een Schip tot gemelte [ Voijagie ] seijl reedt te crijgen ; daer beneffens dat Jegenwoordich geen andere RetourSchepen bijder handt hebben als Vianen ende t'wapen van,Voyage,12-198
10,Voijagie,evokes,12-231,1529-1537,Voyage,None,None,None,None,None,None,None,None,['12-233'],None,None,Voijagie,['12-231'],"handt hebben als Vianen ende t'wapen van Boorn , alleen , behaluen dat van t'wapens suffirante tot t ' [ Voijagie ] nae tvaderblandt seer getwijffelt werdt . Item dat Jegenwoordich ouer Gants Jndia seer schaers van Varend ' volck voorsien ,",Voyage,12-231
11,thuijs-reijse,evokes,12-315,2006-2019,Voyage,None,None,None,None,None,None,None,None,None,None,None,thuijs-reijse,['12-315'],"achter Engelandt , om te loopen , door de moetwil ende rebellije van't Scheepsvolck ( welck gemeenl op de [ thuijs-reijse ] de meester maeckt , ende d'Ouericheijt Hetten voorschrijft niet behoorlijck achtervolcht , maer de cours recht door t'Canael nae Nederlandt",Voyage,12-315
12,cours,evokes,12-330,2119-2124,Voyage,None,None,None,None,None,None,None,None,['12-335'],None,None,cours,['12-330'],"welck gemeenl op de thuijs-reijse de meester maeckt , ende d'Ouericheijt Hetten voorschrijft niet behoorlijck achtervolcht , maer de [ cours ] recht door t'Canael nae Nederlandt gestelt mocht werden , al schoon het tijts genouch eynam om achter om te loopen",Voyage,12-330
13,teseijnden,isOfType,12-371,2358-2368,Transportation,['12-363[94]'],None,None,None,None,None,None,None,None,None,['12-368[95]'],teseijnden,['12-371'],"In voegen , dat ons om voorverhaelde consideratien eenichsints beswaert woirden de syde dus laet met een Schip ouer [ teseijnden ] . Doch aen d'ander sijde ouerwogen , soo noodich het sij V Ed : tegen haere Excessiue lasten , met",Transportation,12-371
14,fourneren,isOfType,12-428,2696-2705,Giving,['12-412[96]'],None,None,None,None,None,None,None,None,None,None,fourneren,['12-428'],"animeren sal omme de requisite capitalen , tot Vigorenter vervolch vandien aduantagieusen handel int ' aenstaende des t'onbecrompener te [ fourneren ] , hebben euenwel goedt gevonden , t'Schip Vranen opt ' spoedichste met 384½. 384½ Nicol sijde 1 331 ... r.",Giving,12-428
15,aff,isOfType,12-473,2923-2926,Transportation[236],None,None,None,None,None,None,"['12-441[98]', '12-467[102]', '12-444[99]', '12-457[101]', '12-452[100]']",None,None,None,['12-435[97]'],aff te vaerdigen,"['12-473', '12-474', '12-475']","Sacken , perper 20 6 1 8 .. lb . Salpeter : beneffens de noodige aduisen , ende bescheijden [ aff te vaerdigen ] . Almogende gelieue UEd : e dit ende de vooraffgebondene Schepen in salko te laten toecomen . 22",Transportation,12-475
16,te,isOfType,12-474,2927-2929,Transportation[236],None,None,None,None,None,None,"['12-441[98]', '12-467[102]', '12-444[99]', '12-457[101]', '12-452[100]']",None,None,None,['12-435[97]'],aff te vaerdigen,"['12-473', '12-474', '12-475']","Sacken , perper 20 6 1 8 .. lb . Salpeter : beneffens de noodige aduisen , ende bescheijden [ aff te vaerdigen ] . Almogende gelieue UEd : e dit ende de vooraffgebondene Schepen in salko te laten toecomen . 22",Transportation,12-475
17,vaerdigen,isOfType,12-475,2930-2939,Transportation[236],None,None,None,None,None,None,"['12-441[98]', '12-467[102]', '12-444[99]', '12-457[101]', '12-452[100]']",None,None,None,['12-435[97]'],aff te vaerdigen,"['12-473', '12-474', '12-475']","Sacken , perper 20 6 1 8 .. lb . Salpeter : beneffens de noodige aduisen , ende bescheijden [ aff te vaerdigen ] . Almogende gelieue UEd : e dit ende de vooraffgebondene Schepen in salko te laten toecomen . 22",Transportation,12-475
18,aengecomen,isOfType,13-11,3083-3093,Arriving,None,None,None,['13-2[103]'],None,None,['13-20[107]'],['13-9[104]'],None,None,['13-12[106]'],aengecomen,['13-11'],"Schepen in salko te laten toecomen . 22 . Otp 20en . Nouembr . is hier van Patane wel [ aengecomen ] t ' Jacht de Griffoen (: geladen met 670 . Baren Ppeper , welck vrij wat dier connot denen W",Arriving,13-11
19,goeden,evokes,17-9,3265-3271,HavingInternalState[237],['17-6[112]'],None,None,None,None,None,None,None,None,None,None,goeden coop,"['17-9', '17-10']","W : Curt Sumatsa . o 1 e de CCormandel : te staen , ten aensien de cleeden seer [ goeden coop ] daer tegen verhandelt sijn soo dat voor dees tijt in dat quartier gants weijnichte doen is , ende niet",HavingInternalState,17-10
20,coop,evokes,17-10,3272-3276,HavingInternalState[237],['17-6[112]'],None,None,None,None,None,None,None,None,None,None,goeden coop,"['17-9', '17-10']","W : Curt Sumatsa . o 1 e de CCormandel : te staen , ten aensien de cleeden seer [ goeden coop ] daer tegen verhandelt sijn soo dat voor dees tijt in dat quartier gants weijnichte doen is , ende niet",HavingInternalState,17-10
21,verhandelt,isOfType,17-13,3288-3298,FinancialTransaction,['17-6[111]'],None,None,None,None,None,None,None,None,None,None,verhandelt,['17-13'],". o 1 e de CCormandel : te staen , ten aensien de cleeden seer goeden coop daer tegen [ verhandelt ] sijn soo dat voor dees tijt in dat quartier gants weijnichte doen is , ende niet noodich wesen sal ,",FinancialTransaction,17-13
22,teseijnder,isOfType,17-38,3432-3442,TransLocation,None,None,None,['17-34[113]'],None,None,None,None,['13-9[105]'],None,None,teseijnder,['17-38'],"tijt in dat quartier gants weijnichte doen is , ende niet noodich wesen sal , t'naeste Jaer derrewaerts weder [ teseijnder ] De Rijs was daer uijt der maten dier ; De toataneten vreesen alsnoch dat den Atchinder van Gueda te Lande",TransLocation,17-38
23,dier,evokes,17-46,3475-3479,HavingInternalState+,['17-39[114]'],None,None,None,None,None,None,None,None,None,None,dier,['17-46'],", ende niet noodich wesen sal , t'naeste Jaer derrewaerts weder teseijnder De Rijs was daer uijt der maten [ dier ] ; De toataneten vreesen alsnoch dat den Atchinder van Gueda te Lande te lande decieitiersn comen sal , daer ons",HavingInternalState+,17-46
24,comen,isOfType,17-62,3571-3576,Invasion,['17-48[116]'],['17-53[118]'],None,None,None,None,None,None,None,None,None,comen,['17-62'],"uijt der maten dier ; De toataneten vreesen alsnoch dat den Atchinder van Gueda te Lande te lande decieitiersn [ comen ] sal , daer ons bedunckt niet veel apparentie toe en is eeee Vande Westcust van Sumatra is hier den 25.en",Invasion,17-62
25,aengecomen,isOfType,18-13,3698-3708,Arriving,None,None,None,['18-8[122]'],None,None,['18-19[126]'],['18-2[119]'],None,None,['18-14[123]'],aengecomen,['18-13'],"niet veel apparentie toe en is eeee Vande Westcust van Sumatra is hier den 25.en d.o . mede abel [ aengecomen ] de fluijt Amstervoen , met 900 . bharen ppever aldaer , tegen cleeden verhandelt , vrij wat proffitabelder dan opde",Arriving,18-13
26,verhandelt,isOfType,18-27,3779-3789,Buying[238]|Selling[239],"['18-19[128]', '18-2[120]|18-26']",None,"['18-2[120]|18-26', '18-2[121]']",None,None,None,None,None,None,None,None,verhandelt,['18-27'],"25.en d.o . mede abel aengecomen de fluijt Amstervoen , met 900 . bharen ppever aldaer , tegen cleeden [ verhandelt ] , vrij wat proffitabelder dan opde custe van Patans , alsoo daer 8o O cento aduance geuen , ende in",Buying,18-27
27,vtreck,isOfType,18-60,3938-3944,Leaving,None,None,['18-55[129]'],None,None,None,None,None,None,None,['18-14[125]'],vtreck,['18-60'],"O cento aduance geuen , ende in Tatane niet meer als 30 . Ot FL W. Cust was opt [ vtreck ] van gemelte Jacht van daer , noch goede partije peper te becomen , ende dat tot redelijcken prus : Ooch",Leaving,18-60
28,becomen,isOfType,18-72,4002-4009,Getting,['18-68[130]'],None,None,None,None,None,None,None,None,None,None,becomen,['18-72'],". Ot FL W. Cust was opt vtreck van gemelte Jacht van daer , noch goede partije peper te [ becomen ] , ende dat tot redelijcken prus : Ooch hebben geldt noch cleeden om derrewaerts ie mogen seijnden . e. e",Getting,18-72
29,hebben,isOfType,18-81,4049-4055,HavingInPossession,"['18-82[131]', '18-84[133]']",None,None,None,None,None,None,None,None,None,None,hebben,['18-81'],"gemelte Jacht van daer , noch goede partije peper te becomen , ende dat tot redelijcken prus : Ooch [ hebben ] geldt noch cleeden om derrewaerts ie mogen seijnden . e. e En D.o S.r Is sier van Masilipats.n ende Paliacaite",HavingInPossession,18-81
30,seijnden,isOfType,18-89,4099-4107,Transportation,"['18-84[134]', '18-82[132]']",None,None,None,None,None,None,None,None,None,None,seijnden,['18-89'],"peper te becomen , ende dat tot redelijcken prus : Ooch hebben geldt noch cleeden om derrewaerts ie mogen [ seijnden ] . e. e En D.o S.r Is sier van Masilipats.n ende Paliacaite wel aengecomen t ' Jacht D Battania met",Transportation,18-89
31,aengecomen,isOfType,20-10,4171-4181,Arriving,None,None,None,['20-1[135]'],None,None,"['20-17[137]', '20-21[138]']","['20-6', '20-8']",None,None,['20-11[136]'],aengecomen,['20-10'],"cleeden om derrewaerts ie mogen seijnden . e. e En D.o S.r Is sier van Masilipats.n ende Paliacaite wel [ aengecomen ] t ' Jacht D Battania met 300 . Clauen ende 134 - packen cleeden , blesde sorteringe , alsoo den",Arriving,20-10
32,becomen,isOfType,20-62,4453-4460,Getting,['20-57[139]'],None,None,None,None,None,None,None,None,None,None,becomen,['20-62'],"hier met de Jachten Grootenbrouck Brouwershauen , ende Battr . eenich ander slach ofte meerder quantiteijt cleeden , te [ becomen ] , ende dit Jaer hebben oock niet anders te verwachten , Soo dat de Molucq , Amboina ende Banida gelijck",Getting,20-62
33,deffectueusheijt,evokes,20-121,4759-4775,HavingInternalState,None,None,None,None,None,None,None,None,None,None,None,deffectueusheijt,['20-121'],Ed : mede in twee Jaeren geen retour van daer becomen sullen ende dat vermidts V Ed : eijgen [ deffectueusheijt ] int derrewaerts beschicken van de Jaerlijcx geeijschte capitalen ... d'E Leeuwwinne ende Kemphaen waren op 2en Novemb . pasro doen,HavingInternalState,20-121
34,vertrock,isOfType,21-16,4936-4944,Leaving,None,None,['16-1[108]'],['21-7[144]'],None,None,None,None,None,None,['21-12[146]'],vertrock,['21-16'],"Jaerlijcx geeijschte capitalen ... d'E Leeuwwinne ende Kemphaen waren op 2en Novemb . pasro doen d'Engelsche Abigael van daer [ vertrock ] , aldaer noch niet verlcheinen , Ende is apparent dat geduerende t'noorder Mouson , daer oock niet sullen connen comen",Leaving,21-16
35,verlcheinen,isOfType,21-21,4964-4975,Arriving,None,None,['16-1[110]'],['21-7[145]'],None,None,None,None,None,None,"['21-4[142]', '21-1[140]']",verlcheinen,['21-21'],"Leeuwwinne ende Kemphaen waren op 2en Novemb . pasro doen d'Engelsche Abigael van daer vertrock , aldaer noch niet [ verlcheinen ] , Ende is apparent dat geduerende t'noorder Mouson , daer oock niet sullen connen comen — . De Paliacatsche sorteringe",Arriving,21-21
36,comen,isOfType,21-36,5058-5063,Arriving,None,None,['16-1[109]'],['21-27[147]'],None,None,None,None,None,None,"['21-4[143]', '21-1[141]']",comen,['21-36'],", aldaer noch niet verlcheinen , Ende is apparent dat geduerende t'noorder Mouson , daer oock niet sullen connen [ comen ] — . De Paliacatsche sorteringe welck al geschilderde doecken sijn ; sal niet eerder dan in Maij a.o . 1628",Arriving,21-36
37,vereinicht,isOfType,23-9,5287-5297,Collaboration,['23-6[149]'],['23-6[149]'],['23-2[148]'],None,['23-6[149]'],None,None,None,None,None,None,vereinicht,['23-9'],"Ouer de 32 . E Pagoden hadden d'onse op leueringe gegeven ee Om de Zuijdt waren de drije Naijcken [ vereinicht ] , waer door aipparent is den Standt in die Quartieren vrij wat beteren dat ende datmen metter tijt goede partije",Collaboration,23-9
38,vrij,isOfType,23-20,5352-5356,HavingInternalState+[240],['23-15[150]'],None,None,None,None,None,None,None,None,None,None,vrij wat beteren,"['23-20', '23-21', '23-22']","ee Om de Zuijdt waren de drije Naijcken vereinicht , waer door aipparent is den Standt in die Quartieren [ vrij wat beteren ] dat ende datmen metter tijt goede partije sal peter sal connen becomen . eeeee Isen Calliacatte geeft het",HavingInternalState+,23-22
39,wat,isOfType,23-21,5357-5360,HavingInternalState+[240],['23-15[150]'],None,None,None,None,None,None,None,None,None,None,vrij wat beteren,"['23-20', '23-21', '23-22']","ee Om de Zuijdt waren de drije Naijcken vereinicht , waer door aipparent is den Standt in die Quartieren [ vrij wat beteren ] dat ende datmen metter tijt goede partije sal peter sal connen becomen . eeeee Isen Calliacatte geeft het",HavingInternalState+,23-22
40,beteren,isOfType,23-22,5361-5368,HavingInternalState+[240],['23-15[150]'],None,None,None,None,None,None,None,None,None,None,vrij wat beteren,"['23-20', '23-21', '23-22']","ee Om de Zuijdt waren de drije Naijcken vereinicht , waer door aipparent is den Standt in die Quartieren [ vrij wat beteren ] dat ende datmen metter tijt goede partije sal peter sal connen becomen . eeeee Isen Calliacatte geeft het",HavingInternalState+,23-22
41,becomen,isOfType,23-34,5432-5439,Getting,['23-28[151]'],None,None,None,None,None,None,None,None,None,None,becomen,['23-34'],den Standt in die Quartieren vrij wat beteren dat ende datmen metter tijt goede partije sal peter sal connen [ becomen ] . eeeee Isen Calliacatte geeft het Goudt van Guinea 10½ 8r . cento advance ende was t'Cattoen daer soo dier,Getting,23-34
42,dier,evokes,24-18,5543-5547,HavingInternalState+,['24-15'],None,['24-2'],None,None,None,None,None,None,None,None,dier,['24-18'],". eeeee Isen Calliacatte geeft het Goudt van Guinea 10½ 8r . cento advance ende was t'Cattoen daer soo [ dier ] , als in lange Jaren niet geweest is Pr. Madilwals . continueerden de Mooren haere Monovolien ende Qquardt tractement t'ontwaerts",HavingInternalState+,24-18
43,handelen,isOfType,24-52,5751-5759,FinancialTransaction,None,"['24-50', '24-45[152]']",None,None,None,None,None,None,None,None,None,handelen,['24-52'],"haere Monovolien ende Qquardt tractement t'ontwaerts ; Met niemant anders dan met drije deee pachters , mochten d'onse aldaer [ handelen ] ; Ende noch werdt haer opgedicongen sulcken sorteringe als sij selfs willen : Waer tegen met soete middelen niet te",FinancialTransaction,24-52
44,becomen,isOfType,28-7,6172-6179,Getting,['28-1[153]'],None,None,None,None,None,None,None,None,None,None,becomen,['28-7'],"voor reen tijt e 1 „ 90 t ked ee . ve een Diamanten sijn daer noch wel te [ becomen ] , maer dier eeen tijt van masilupats . te lichten ende eenige Scheepen in de mlaenden Februarij ende Meert daer",Getting,28-7
45,dier,isOfType,28-10,6187-6191,HavingInternalState+,['28-1[154]'],None,None,None,None,None,None,None,None,None,None,dier,['28-10'],"e 1 „ 90 t ked ee . ve een Diamanten sijn daer noch wel te becomen , maer [ dier ] eeen tijt van masilupats . te lichten ende eenige Scheepen in de mlaenden Februarij ende Meert daer voor te houden",HavingInternalState+,28-10
46,betalen,isOfType,32-44,7251-7258,FinancialTransaction,['32-41[155]'],None,None,None,None,None,None,None,None,None,None,betalen,['32-44'],"Negotie saten , belast sijnde met 200 O gl . a deposito gelicht , waer voor grooten Interest moeten [ betalen ] Ede specerijen Nagelen , Nooten ende foelije waren meer dan 50 . Rcento in prijs gedaelt , conden geene vercoopen",FinancialTransaction,32-44
47,gedaelt,isOfType,33-16,7340-7347,Decreasing,['33-15'],None,None,None,None,None,None,None,None,None,None,gedaelt,['33-16'],"grooten Interest moeten betalen Ede specerijen Nagelen , Nooten ende foelije waren meer dan 50 . Rcento in prijs [ gedaelt ] , conden geene vercoopen , dan tot leegen Phris Ambeine Banda Js Almigon eicht bij paliacatte drijuen d'Engelschen haren handel",Decreasing,33-16
48,vercoopen,isOfType,33-20,7363-7372,Selling,"['33-5[161]', '33-3[159]', '33-7[163]', '33-2[157]']",None,None,None,None,None,None,None,None,None,None,vercoopen,['33-20'],"Ede specerijen Nagelen , Nooten ende foelije waren meer dan 50 . Rcento in prijs gedaelt , conden geene [ vercoopen ] , dan tot leegen Phris Ambeine Banda Js Almigon eicht bij paliacatte drijuen d'Engelschen haren handel , welcke plaetse haer",Selling,33-20
49,leegen,evokes,33-24,7383-7389,HavingInternalState,['33-25'],None,None,None,None,None,None,None,None,None,None,leegen,['33-24'],"Nooten ende foelije waren meer dan 50 . Rcento in prijs gedaelt , conden geene vercoopen , dan tot [ leegen ] Phris Ambeine Banda Js Almigon eicht bij paliacatte drijuen d'Engelschen haren handel , welcke plaetse haer soo : dienstich is",HavingInternalState,33-24
50,geboorden,isOfType,36-19,7809-7818,Transportation,['36-26[170]'],None,None,None,None,None,None,['36-10[165]'],['36-17[167]'],None,['36-21[168]'],geboorden,['36-19'],"sullen Met onse Jongste is uEd : geaduiseert hoe van hier door de Strate van Mallacca nae Masilipats . [ geboorden ] hadden t ' Jacht Wedenblycq met een Capitael van l 120885 „ 15 „ Waer mede oock ouergegaen is ,",Transportation,36-19
51,ouergegaen,*,36-37,7899-7909,TransLocation,['36-40[171]'],None,None,None,None,None,None,['36-10[164]'],['36-17[166]'],None,['36-21[169]'],ouergegaen,['36-37'],". geboorden hadden t ' Jacht Wedenblycq met een Capitael van l 120885 „ 15 „ Waer mede oock [ ouergegaen ] is , Mousabeeck , Ambassadeur des Conincks van Pertia . Onise cruijssende Jachten hebben t'selue den 35e Octob . pasto",TransLocation,36-37
52,reijs,evokes,36-76,8138-8143,Voyage,None,None,None,None,None,None,None,None,None,None,None,reijs,['36-76'],"pasto . omtrent ppoulo - Vercelaer bij Noorden Mallacca gerescontreert . Waer ouer aipvarent is , dat een spoedige [ reijs ] doen sal , twelck Godt gene dr 21e . Septembris pasen . was t'Jacht Grombershanen van Masilivas . naer Arraccan",Voyage,36-76
53,vertrocken,isOfType,37-14,8256-8266,Leaving,None,None,['37-10'],['37-1[172]'],None,None,['37-19[176]'],None,['37-13[174]'],None,['37-7[173]'],vertrocken,['37-14'],"sal , twelck Godt gene dr 21e . Septembris pasen . was t'Jacht Grombershanen van Masilivas . naer Arraccan [ vertrocken ] met een Cargasoen van ƒ 3900 . om tselue aen blauen , otterijs te besteden , met ordre dat tegen",Leaving,37-14
54,Keere,isOfType,37-42,8404-8409,Leaving,None,None,['37-13[175]'],['37-34[177]'],None,None,None,None,['37-40'],None,None,Keere,['37-42'],"tselue aen blauen , otterijs te besteden , met ordre dat tegen hal ff December weder voor Masilipats . [ Keere ] . uo 16en . Decemb . passaco hebben van hier naer Amboina , ende Gaudamet de Noodige comptanten coopmanschappen ende",Leaving,37-42
55,gesonden,isOfType,38-20,8537-8545,Transportation,['38-14[179]'],None,None,['38-1[178]'],None,None,None,None,"['38-10', '38-13']",None,"['38-25[182]', '38-23[180]']",gesonden,['38-20'],"16en . Decemb . passaco hebben van hier naer Amboina , ende Gaudamet de Noodige comptanten coopmanschappen ende prouisien [ gesonden ] de Schepen Suijdthollandt ende den Arent , met ordre dat in compen . Amboina sullen aendoen , ende dat het",Transportation,38-20
56,aendoen,isOfType,38-36,8630-8637,Arriving,None,None,['38-34[185]'],None,None,None,None,None,None,None,"['38-23[181]', '38-25[183]']",aendoen,['38-36'],"coopmanschappen ende prouisien gesonden de Schepen Suijdthollandt ende den Arent , met ordre dat in compen . Amboina sullen [ aendoen ] , ende dat het Shp Hollandt van daer voorts naer Banda sal loopen , soo haest in Amboina gemust _",Arriving,38-36
57,loopen,isOfType,38-49,8697-8703,Voyage,None,None,None,None,None,None,None,['38-34[184]'],['38-47'],None,['38-41[186]'],loopen,['38-49'],"dat in compen . Amboina sullen aendoen , ende dat het Shp Hollandt van daer voorts naer Banda sal [ loopen ] , soo haest in Amboina gemust _ . can worden Met gemelte Schepen hebben wij naer Amboina ende Banda affgevaerdicht",Voyage,38-49
58,affgevaerdicht,isOfType,39-10,8804-8818,TransLocation,"['40-2[189]', '39-16[187]']",None,None,None,None,None,None,None,"['39-9', '39-7']",None,None,affgevaerdicht,['39-10'],", soo haest in Amboina gemust _ . can worden Met gemelte Schepen hebben wij naer Amboina ende Banda [ affgevaerdicht ] als onse expresse Gecommitteerde den Oppercoopman Gregorius Cornelij ermmate Etr ende Capn . Marten Jansz Vogel , omme in d‛een",TransLocation,39-10
59,Oppercoopman,evokes,39-16,8856-8868,BeingEmployed,['39-17[188]'],None,None,None,None,None,None,None,None,None,None,Oppercoopman,['39-16'],"_ . can worden Met gemelte Schepen hebben wij naer Amboina ende Banda affgevaerdicht als onse expresse Gecommitteerde den [ Oppercoopman ] Gregorius Cornelij ermmate Etr ende Capn . Marten Jansz Vogel , omme in d‛een ende d'ander plaets te bevoirderen sulcx",BeingEmployed,39-16
60,Capn,evokes,40-2,8905-8909,BeingEmployed,['40-4[190]'],None,None,None,None,None,None,None,None,None,None,Capn,['40-2'],"Schepen hebben wij naer Amboina ende Banda affgevaerdicht als onse expresse Gecommitteerde den Oppercoopman Gregorius Cornelij ermmate Etr ende [ Capn ] . Marten Jansz Vogel , omme in d‛een ende d'ander plaets te bevoirderen sulcx als den meesten dienst ende woelstandt",BeingEmployed,40-2
61,Commissaris,evokes,40-42,9166-9177,BeingEmployed,['40-43[192]'],None,None,None,None,None,None,None,None,None,None,Commissaris,['40-42'],"Compen . aldaer vereijscht , Insonderheijt inde Quartieren van Amboina , alwaer wbij bevinden volgens t'schriftelijck schriftelijck verbael vanden [ Commissaris ] Gillis Seijs , In April pase . aende cant van 616 . blancke coppen in dienst ende gagie vande Compnie",BeingEmployed,40-42
